"final_category","narrative_1","synopsis","assessments","events","events_6","phase","component","component_4","person_1_8"
"OTHER","Air carrier First Officer reported receiving a GPWS terrain alert on approach to MMMM/MLM airport.","I was flying into Morelia. The pilot monitoring and pilot flying did brief the plate and company notes before flying this approach. Flying VOR Y RWY 23 approach. I believe before DME 12.0 I realized quickly that I was too high; I believe we were at 10;000 FT MSL. I told the pilot monitoring that I was too high. At that point I do not recall exactly what we decided to do. I believe we chose to utilize flaps 9; speed brakes out; power idle; and more of a descent rate. Within seconds of trying to drop quickly; I realized again that we were just too high for this approach. At that point a 360 turn was suggested. The pilot monitoring then asked ATC if we were allowed to do a 360. Which ATC said; 'it was more than fine'. During the 360 turn and descending we received one audible warning of 'TERRAIN'. At that moment I pilot flying leveled out; stopped the descent; full throttle and started to climb. The audible warning was [heard] once and went away. The pilot monitoring advised to keep the turn coming.  As we finished the turn; we were back at our original dilemma of being too high. We tried to drop quickly again with no success. At that point; we chose to conduct the go-round procedures with no further issues.I believe why we were too high is we were trying to make the box more suitable for our approach.I read this plate over and over after this incident. I know we might think certain things are easier to do; but I will just fly the missed approach. That is what it is there for.","Environment - Non Weather Related; Human Factors","ATC Issue All Types; Deviation / Discrepancy - Procedural Published Material / Policy; Inflight Event / Encounter CFTT / CFIT; Inflight Event / Encounter Unstabilized Approach","Flight Crew Became Reoriented; Flight Crew Took Evasive Action","Initial Approach","","","Situational Awareness"
"OTHER","Air Taxi First Officer reported landing safely after receiving a low altitude alert on short final to BOS airport.","We were given ILS 4R and were subsequently given a visual approach. Approximately 1/2 to 1 mile prior to the runway; I was given a low altitude alert with the correct altimeter setting. I did have the vertical guidance for the ILS still up and showed 1 dot low on the glideslope. I revisited the altitude and track logs and saw an increase in descent rate in the path prior to the alert being issued and speculate that this may be a contributing reason for the alert on the visual approach. Though visual in daylight conditions; I will use the vertical ILS guidance as an additional tool to assist in preventing re-occurrence.","Human Factors","Inflight Event / Encounter CFTT / CFIT","Air Traffic Control Issued Advisory / Alert; Flight Crew Became Reoriented","Final Approach","","","Situational Awareness"
"OTHER","Air carrier Captain reported receiving a low altitude alert from ATC on approach to LAX; citing possible miscommunication with ATC as contributing.","While on descent for turn to final approach; autopilot engaged; we were given a descent clearance to 1;600 feet. This is a low altitude; but we were being vectored for our base turn shortly. We were told to; 'Expedite descent.'  We all know ATC has minimum vectoring altitudes that aren't listed in our charts. When the clearance was given; my pilot monitoring FO set the altitude and pointed at the number without speaking it as is company policy. I confirmed that was the altitude given by pointing at the number and stating '1;600 feet.'Our relief FO was also in the flight deck during this final phase and had been for several hours. We all three heard the clearance. As we descended through 2;000 feet ATC said; 'Low altitude alert. Climb immediately to 2;600.' My monitoring FO read back the clearance and put in the new altitude and pointed; I pointed and stated 2;600 feet while engaging Flight Level Change. The plane smoothly climbed 600 feet. At this point I stated that I had initially heard 1;600. My monitoring FO said that's what she heard too.  The relief FO said that the controller DID say 1;600 feet. I'm confident that all three of us heard what we were assigned. At the time we clearly had the ground in site and visibility was such that when we were turned towards the airport that we had the runway in sight. Instrument and visual approaches were being conducted. The rest of the flight was uneventful.","Human Factors","ATC Issue All Types; Deviation - Altitude Overshoot; Deviation / Discrepancy - Procedural Clearance; Inflight Event / Encounter CFTT / CFIT","Air Traffic Control Issued Advisory / Alert; Air Traffic Control Issued New Clearance; Flight Crew Returned To Clearance; Flight Crew Took Evasive Action","Final Approach","","","Communication Breakdown; Situational Awareness"
"OTHER","TRACON Controller reported aircraft descended below assigned altitude on approach resulted in a low altitude alert and a CFTT event.","A BE9L was requesting ILS Approach into RWY XX at ZZZ Airport. At the time ZZZ Tower was closed. The aircraft was coming from the southwest direct ZZZZZ. I told the aircraft to expect radar vectors to final. I descended the aircraft to 060. I then issued the approach clearance; I emphasized the altitude assignment; 'Descend and maintain five thousand two hundred (052).' The aircraft read back the altitude assignment correctly. I continued to observe the aircraft as I saw a Low Altitude alert on the aircraft above the MVA. As soon as the aircraft passed 052 I issued a climb back to 052 and issued a low altitude alert. The aircraft immediately complied and climbed back to assigned altitude. The approach continued without further incident. The lowest the aircraft got to was 048 in the 052 MVA as he was rapidly descending.Recommendation: Pilots sometimes say they will do something and do something different. Not sure how to remedy this. Pilots already have high workload; but they need to be fully focused.","Human Factors","Deviation - Altitude Overshoot; Deviation / Discrepancy - Procedural Clearance; Inflight Event / Encounter CFTT / CFIT","Air Traffic Control Issued Advisory / Alert; Flight Crew Returned To Clearance; Flight Crew FLC complied w / Automation / Advisory","Descent","","","Situational Awareness"
"OTHER","C-172 Flight Instructor reported a near mid air collision with departing aircraft while entering traffic pattern.","We were on a 45 into the right downwind for runway XX at pattern altitude (about 5 miles from the airport). Tower told departing traffic to make a right turn which pointed them directly at us. Upon realizing we were about to collide (1 Mile apart same altitude and within 30 degrees of being head to head) I made a descending left turn to avoid the collision. As I was making the turn the aircraft gave me a traffic alert and I notified tower of our deviation. It is my opinion that tower's response to this occurrence was inadequate and too relaxed.","Human Factors; Procedure","ATC Issue All Types; Conflict NMAC; Deviation / Discrepancy - Procedural Clearance","Flight Crew Took Evasive Action","Initial Approach","","","Communication Breakdown"
"OTHER","Part 107 UAS pilot reported a brief entry into controlled airspace without authorization. The pilot immediately exited the controlled airspace.","As the Remote Pilot in Command (RPIC); I was operating a DJI Mini 4 Pro with a Plus Battery (total weight 291g) for a commercial photography flight.The flight took place at Location A in Class C Airspace with a designated maximum altitude of 100 feet.Day 0 approx. XA:40am The incident occurred during an automated MasterShots flight.My drone was flying an automated MasterShots circuit. Upon realizing that the automation would exceed the 100-foot altitude restriction; I stopped the flight immediately. However; due to inertia; the drone continued to climb slightly; reaching a maximum altitude of 32 meters (104.9 feet)--4.9 feet into controlled airspace. I immediately lowered the altitude back below 100 feet.The altitude violation occurred due to the inertia of the drone after stopping the automated flight. I failed to anticipate the impact of momentum in an automated flight mode.To prevent this in the future; I will never fly automated MasterShots in areas with height restrictions. Additionally; I will manually control flights in restricted airspace to ensure strict adherence to altitude limits.","Human Factors; Software and Automation","Airspace Violation All Types; Deviation / Discrepancy - Procedural Published Material / Policy; Deviation / Discrepancy - Procedural FAR; Deviation / Discrepancy - Procedural Unauthorized Flight Operations (UAS)","Flight Crew Exited Penetrated Airspace","","","","Situational Awareness"
"OTHER","Cessna 210 pilot reported a near midair collision with a jet aircraft on approach at intersecting runways. The pilot initiated a go-around to prevent a conflict.","I was flying an aircraft from ZZZ1 to ZZZ. When I was 8 miles out; I started announcing my position and noted there were at least 4 other aircraft in the pattern and they were all using Runway XX. I flew southwest of the field and entered a downwind for Runway XX. I turned my base leg and noted other aircraft behind me in the pattern. Shortly after turning on final for Runway XX; I heard a call out from another aircraft (jet) that they were going to use Runway XY (which would be a downwind landing with an intersection crossing on Runway XX.) At about the same time there were other aircraft in the downwind which would be in direct conflict with the jet. The jet then announced he was on final and I was in immediate danger of a direct conflict as his flight path and mine would intersect between Runway XY and Runway XX. I announced on the Unicom that aircraft in the pattern were already using Runway XX; but that I would do a go around to avoid conflict.After landing I noted the aircraft identification. A few moments later I then noted another jet of same make and model took off from Runway XZ; which was then not only downwind; but in direct conflict with prevailing traffic using Runway XX. These two aircraft appeared to be from the same operator on the field and were apparently flown by the same pilot. My strong recommendation is that given the busy student filled pattern at ZZZ; that all jet aircraft not only should exercise extreme caution but that they use the pattern properly; avoid crossing intersecting runways and announce far enough out to observe and plan their approach accordingly. It would also be helpful if ZZZ Approach warned aircraft flying into ZZZ of the constant student traffic and parachute operations which both contribute to a crowded uncontrolled airspace.","Airspace Structure; Human Factors","Conflict NMAC","Flight Crew Executed Go Around / Missed Approach","Final Approach","","","Communication Breakdown; Workload"
"OTHER","Air carrier pilot reported that on final approach to JAX the turn-off lights for Taxiway H and G create an illusion where it looks like there is a vehicle or plane on Runway 26.","On final approach; around the FAF; the taxi turn-off lights for Taxiway H and G look like a vehicle or plane on the runway; just left of centerline. This is for Runway 26. No other runway I've landed on has this illusion caused by turnoff or taxiway lighting.Lights need to be adjusted to not be visible from the air.","ATC Equipment / Nav Facility / Buildings","Ground Event / Encounter Ground Equipment Issue","","Initial Approach","","","Workload; Situational Awareness; Distraction; Confusion"
"OTHER","A Flight Instructor reported two NMAC's while on downwind in the Tower VFR pattern.","Coming back in from the mountain pass; VFR in bound full stop at ZZZ. Tower told us to enter 45 to the downwind for right traffic runway XXR and to follow traffic in front of us (Cherokee). As we were starting our turn to the downwind the Archer that was following us in was told by Tower to follow the traffic that we were told to follow (Cherokee). They (the Archer) then cut us off getting so close that I could see the people in the aircraft. At this point I took flight controls and initiated a 360 degree turn in the downwind for spacing. Then a different controller came on to apologize for the miscommunication and let us know they (the previous controller) were training. Later in the downwind Tower again initiated a 360 for spacing to which the Archer did a turn 540 degrees. When exiting the turn; they looked head on to us; resulting in us having to again take evasive action. Tower then told them to fly base along the freeway which then allowed them to change course. Throughout this interaction there were no traffic alerts issued by the tower. Final to landing no incidents occurred. I also called the tower manager following this occurrence. They again apologized and suggested we speak up when we believe instructions are incorrect and also for all to maintain more vigilance in this crowded airspace","Procedure; Human Factors; Environment - Non Weather Related","ATC Issue All Types; Conflict NMAC","Air Traffic Control Issued New Clearance; Flight Crew Requested ATC Assistance / Clarification; Flight Crew Took Evasive Action","Initial Approach","","","Confusion; Communication Breakdown; Training / Qualification; Workload"
"OTHER","Air carrier flight crew reported the TRACON Controller descended them to an altitude below the minimum vectoring altitude then issued a low altitude alert.","Arriving into ZZZ on downwind leg to runway XXR off the ZZZ arrival; we were given a descent to 4000 feet before ZZZZZ. We were then given a descent to 1600 feet and told to expedite"". All three of us heard this and I read back the descent clearance of 1600 feet. As I was doing so; I was mentally thinking that this altitude is lower than normal; there is terrain in the area; however I think we are okay since we are going to make a right turn towards the airport now; and it is VMC. But also thinking; there must be traffic somewhere we cannot see due to the ""expedite"" and/or; we are being squeezed in on the approach. As we were descending through approximately 2100 feet; the controller called out an altitude alert to us and to climb to 2600 feet which we immediately did so. In listening to the ATC tapes; I do believe I hear 1600 feet assigned from the controller; but also feel I should have questioned the altitude. The rest of the flight went without incident. ATC Issued Low Altitude Warning.""","Airspace Structure; Chart Or Publication; Human Factors; Procedure","ATC Issue All Types; Deviation - Altitude Overshoot; Deviation / Discrepancy - Procedural Clearance; Deviation / Discrepancy - Procedural Published Material / Policy; Inflight Event / Encounter CFTT / CFIT","Air Traffic Control Issued Advisory / Alert; Flight Crew FLC complied w / Automation / Advisory; Flight Crew Became Reoriented; Flight Crew Requested ATC Assistance / Clarification","Final Approach","","","Workload; Situational Awareness; Communication Breakdown"
"OTHER","Light aircraft pilot reported an NMAC on approach to D57 airport.","I was approaching D57 from the East at pattern elevation on the south side of the east-west runway.    My intention was to make a 180 to enter downwind.    I did not hear another aircraft on the radio until after we passed.    Evidently; the other aircraft was on a downwind.   His pattern evidently was wider than I am used to.    When I heard the audio warning; I angled farther to the right to allow saving for us to pass.     When I got on downwind; I heard his call for base and final.   I extended my downwind to allow plenty of separation.   When I turned final; the other aircraft announced short final.    I still could not see him.   Difficult to see.   Finally; I was able to see him getting off the runway while I was still on final.Looking back;   I should have approached several miles farther south of the pattern and then entered on a 45 to downwind.","Human Factors","Conflict NMAC","Flight Crew Took Evasive Action","Initial Approach","","","Communication Breakdown; Situational Awareness"
"OTHER","Flight Instructor reported during landing roll-out a small jet did a go-around overflying the instructor's aircraft.","On Day 0 at approximately XA25; I was conducting a training flight for a High Performance endorsement in Aircraft X. I was in the right seat; and the student was in the left seat; he was manipulating the controls. We took off from AFJ; after doing some air work to the south; we returned to AFJ for pattern work. After one full stop; we taxied back to runway 27 for another lap in the pattern. The takeoff was normal; I saw multiple targets on the Garmin Perspective+ while we were on downwind for 27 but no one was on frequency and the targets were not visible; and did not appear to be a factor. The landing was normal; in the roll out on the runway; the Garmin was showing a target of +100 feet at our position. At this time; I looked up and Aircraft Y listed above was doing a low pass over the runway in the direction of Runway 27. Which I later found out was an unexpected Go Around due to us being on the runway. I attempted radio contact with Aircraft Y who I now had visibly in the downwind for 27. He responded without delay; he continued his pattern to a full stop landing on Runway 27; however with only one radio call of his position while in the pattern. I talked to the ground crew that filled the airplane with fuel before they departed; who witnessed the close call. They stated the Pilot of Aircraft Y admitted they have been having radio problems.","Human Factors","Conflict Ground Conflict; Critical","Flight Crew Took Evasive Action","Landing","","","Communication Breakdown"
"OTHER","Low wing aircraft Flight Instructor reported taking evasive action to avoid traffic resulted in a NMAC event.","The event happened during my second flight of the day upon arrival back to GYR. We were flying the Gap Arrival at 2;500MSL and I was instructing my SP on the arrival  procedures and the associated landmarks. My student made the initial call to GYR tower and received a clearance of left downwind for runway 21. When approximately 1 to 2 miles south of the gap GYR's tower controller informed us of traffic. I looked up and saw what I believed to have been the traffic which was a light sport aircraft north of the gap and above us. My student first noticed the traffic and began turning the aircraft left (north west) and shortly thereafter I heard the G1000's traffic warning and looked up to see an aircraft southbound at approximately our same altitude but slightly offset to the east side of the gap close to the mountains. Taking controls I initially turned left (west) as the traffic as to our right but then shortly after beginning my turn the aircraft turned in our direction southwest bound. This is when I decided to perform an emergency descent and turned away from rising terrain. After descending 500 feet the opposing traffic passed behind us and continued westbound. We continued the gap arrival with no further incident. Additionally; it sounded like the same controller was working both tower and ground frequency at GYR.","Airspace Structure; Airport","Conflict NMAC","Flight Crew Took Evasive Action","Cruise","","","Time Pressure"
"OTHER","Air carrier Captain reported receiving a low altitude warning from ATC during an unstable approach in visual conditions. The pilot performed a go-around and returned for a landing.","We were setup for and briefed the SNDIA 4 RNAV Arrival followed by the RNAV (RNP) Y Rwy 21.  About 30 NM from ABQ airport approach control gave a heading to fly and said to expect the visual approach Rwy 21.  I elected to use the final portion of the briefed RNAV approach as reference for the visual approach.  We were cleared for the visual approach at an approximately 5 NM right base for Rwy 21.  I did not set TDZE in the altitude window and selected Approach instead of utilizing LNAV/VNAV.  Without benefit of reasonable flight director guidance; I descended to approximately 6400 feet (1000 feet AGL) as I was visually maneuvering to wings level on final.  When rolling wings level I recognized I was not in a good position to land (low on PAPI; otherwise stable) from this approach and initiated a Go Around.  Tower called soon after Go Around initiation to give a low altitude warning.  The Go Around was uneventful and we were vectored for another visual approach to Rwy 21 that culminated in a successful landing.If I was in the same situation again I would initiate the Go Around sooner.  I know that I was behind on this approach.  Though I was comfortable that the aircraft was visibly clear of obstacles on final; I allowed myself to descend to 1000 feet AGL too far from the Runway.  I didn't have much time to discuss; once we were told to expect the visual approach; but I could have done more to prepare for a successful approach.  I told the FO that I would utilize the RNAV for reference.  But; I should have also reiterated how I intended to use LNAV/VNAV and would remove Baro mins from the PFD and set TDZE instead.","Human Factors; Software and Automation","Deviation / Discrepancy - Procedural Published Material / Policy; Inflight Event / Encounter CFTT / CFIT; Inflight Event / Encounter Unstabilized Approach","Air Traffic Control Issued Advisory / Alert; Flight Crew Executed Go Around / Missed Approach","Final Approach","","","Communication Breakdown; Human-Machine Interface; Situational Awareness"
"OTHER","Flight instructor reported while in the pattern another aircraft was not allowing for spacing resulting in the flight instructor taking evasive action to avoid a collision with the other aircraft.","I was performing commercial training with a student. There were two other aircraft in the pattern; one on final and another on upwind turning crosswind. We made an announcement 7 miles out and 3 miles out on our intentions. We were going to enter downwind and we made that call until Aircraft Y decided to not respond to us. We then announced that we would follow behind them on the downwind. As we were setting up for the short field landing they followed very close behind us but we were still able to complete the landing. However; I told the other aircraft to maintain better separation. They just said they saw us. When my student completed his short field landing we then took off again. They did a go-around as were turning crosswind. As we performed our gear down go down on downwind operations Aircraft Y was already on the downwind. We announced that we were turning base and final. Aircraft Y insisted on doing a simulated engine out. I told them we are on a short final do you see us? She insisted she did but did not extend; instead; she just headed right towards us. We went around immediately to avoid them and they had to go around as well as they couldn't make the runway. They flew parallel with us and came very close to us. This is unacceptable behavior and this is uncalled for.","Human Factors","Conflict Airborne Conflict; Conflict NMAC; Deviation / Discrepancy - Procedural Published Material / Policy","Flight Crew Took Evasive Action","Final Approach","","","Communication Breakdown"
"OTHER","ZDV Controller reported that due to lack of sufficient radio coverage in ZDV and ZAB airspace they were unable to issue a higher altitude to an aircraft which had been assigned an altitude below the Minimum IFR Altitude.","Aircraft X was level 090 southbound to RTN; expecting the RNAV 25 approach. It had been determined incorrectly that the Aircraft could climb to 100 and fly direct ECDOL to avoid any higher MIAs along the route. There was a 5 mile approximate section of 110 MIA along the route; close to the sector boundary; that was missed. Aircraft was handed off to ZAB16 (PO to ZAB15) and coordinated the expected approach request; and that the Aircraft was released for control from ZDV41; and then shipped. Aircraft could not initially reach ZAB16 by radio; so came back to ZDV41. I said to keep trying every minute or so (after calling ZAB16 to confirm they would be able to talk to him; eventually). The MIA alert began going off a few minutes later; and ZAB was eventually able to climb the Aircraft to 110; but not before he crossed into the 110 MIA area.","ATC Equipment / Nav Facility / Buildings; Airspace Structure; Human Factors","ATC Issue All Types; Deviation / Discrepancy - Procedural Published Material / Policy; Ground Event / Encounter Ground Equipment Issue; Inflight Event / Encounter CFTT / CFIT","Air Traffic Control Provided Assistance","Cruise","","","Situational Awareness; Workload; Communication Breakdown"
