"final_category","narrative_1","synopsis","assessments","events","events_6","phase","component","component_4","person_1_8"
"OTHER","Student Pilot reported a NMAC while on initial climb out.","The aircraft I was in was on an IFR flight from ZZZ and going to ZZZ1. I was on ZZZ Tower XXX.X. Tower instructs me to line up and wait on Runway XXR. There was departing traffic on the upwind of XXR. I was getting ready for the takeoff; and I kept in mind of the departing traffic. I lost sight of them when Tower instructed me; 'Aircraft X clear for takeoff Runway XXR fly runway heading'. As I was on a takeoff roll; the gauges were green; and the airspeed was alive. I rotated and flew runway heading. I was between 625 to 825 MSL when my G1000 system gave me an audible warning; 'Traffic; 100 feet below.'. The one thing I did not know was if there was right traffic for XXR or if it was left traffic. I kept flying straight out and increased my climb to VX to get more distance. As I was climbing I saw the aircraft; which was a Cherokee turning left some 100 ft. below me. ZZZ Tower did not give me any traffic alerts. They were very busy; and I was trying to get a phone number from them to do reporting but could not get a chance to. I kept flying; and ZZZ Tower told me to switch to Approach. I got radar vectors and continued on with my flight plan.","Environment - Non Weather Related; Human Factors; Procedure","Conflict NMAC","Flight Crew Took Evasive Action","Takeoff / Launch","","","Confusion"
"OTHER","Air carrier Captain reported a conflict as an aircraft was cleared for takeoff on the same runway while they were on final approach below 500 AFE resulting in a go-around.","While conducting the visual approach backed up by the ILS 35 ILM; the aircraft was fully configured with landing checklist completed. I was pilot monitoring (PM); and the First Officer (FO) was pilot flying (PF). We were below 500 AFE; and the Tower cleared an Aircraft Y to takeoff on Runway 35; and the aircraft was not even in position on the runway; they still needed to line up. Aircraft Y was instructed to expedite with no delay to begin their takeoff roll. Aircraft Y could only go so fast; and we quickly saw this potential disaster unfolding. The FO keyed his microphone and said 'this isn't going to work'. Moments later at 396 AFE; the FO initiated a go-around at his discretion. Tower said 'let's wait and see' in regards to needing to go-around. It was blatantly obvious there was zero chance this was going to work. The Tower then directed an immediate left turn on the go-around as Aircraft Y was now climbing into us. TCAS then provided multiple 'TRAFFIC TRAFFIC' TAs as Aircraft Y was right below us despite us turning left. In the process of the GA; the FO did momentarily overspeed the flaps by 1-2 kts. We then were vectored back around and landed uneventfully the second time. The Tower apologized and I requested a phone number to discuss with the controller on the ground after as this was completely unacceptable and an unsafe thing the controller did for seemingly no reason. The Tower said upon the phone call that 'it would have worked out in a perfect world' which was extremely concerning to hear them say this. This isn't a perfect world and in no world would this have worked out.Cause: The cause of this event was the controller clearing an aircraft to takeoff as we were very short final at below 400 feet. This was an extremely poor decision by ATC that should not have occurred. There was also simply no reason for this given it was not busy at the airport. This led to an unnecessary go-around and further complications such as overspeeding the flaps; and numerous passengers throwing up everywhere and being on edge about what was going on.Suggestions: ATC should not have cleared another aircraft for takeoff that close in. They seem to now be aware after my phone call with them that this was not okay and should not have happened. There's not many further suggestions I could make aside from being vigilant of other traffic nearby when landing and taking off so you're aware of potentially hazardous situations such as this.","Human Factors; Procedure","ATC Issue All Types; Conflict Ground Conflict; Critical; Deviation - Speed All Types; Deviation / Discrepancy - Procedural Published Material / Policy","Flight Crew Executed Go Around / Missed Approach","Final Approach","","","Communication Breakdown"
"OTHER","Air carrier Captain reported the aircraft was relatively high on the PAPIs and the flight crew was unable to align with PAPI guidance while attempting to correct despite being on the RNAV approach glide path.","When flying into SAV they were advertising the visual approach to Runway 28. I backed it up with the RNAV approach (this is the only one they had available). We were cleared for the approach when we reported the airport in sight. I started the approach by intercepting the final course then followed by the glide path. As we were descending on the glide path I began to notice that we were relatively high on the PAPIs. All four indicators were white while on glide path. I verbally stated that I was correcting to meet the PAPIs. This required a more steep angle than it should have. My Captain Operating Experience candidate was monitoring the vertical speed and air speed; as was I. I had to maintain 1000 fpm to try to meet the PAPIs. We never got on the PAPIs. At no time did the approach go unstable per the stabilized approach criteria. I was planning on a go-around if it did. I did get one sink rate"" warning at the beginning of the flare but indicated I was correcting. We landed normally; on proper speed in the touchdown with a normal touchdown rate. I wanted to bring this up because I feel this could result in problems if it were to go down to minimums on an actual instrument approach.""","ATC Equipment / Nav Facility / Buildings; Airport","Ground Event / Encounter Ground Equipment Issue; Inflight Event / Encounter Unstabilized Approach","","Final Approach; Initial Approach","","",""
"OTHER","An observer reported seeing footage of a UAS possibly flying above 400 feet AGL and flying near two aircraft.","A drone was flying above ZZZ on Day 0; footage shows it getting close to a Cessna; flightradar records shows 2 Cessna's were flying at or around 1;000 and 1;600 ft at the same time which means the drone was above its legal altitude and flying near other aircrafts.","Human Factors; Procedure","Airspace Violation All Types; Deviation / Discrepancy - Procedural FAR; Deviation / Discrepancy - Procedural Published Material / Policy; Deviation / Discrepancy - Procedural Unauthorized Flight Operations (UAS)","General None Reported / Taken","","","",""
"OTHER","A Center Controller reported after they took over a busy combined sector they failed to notice an air carrier conflicting with an unidentified VFR target.","The sector I had been working when I originally came in today; closed (Sector XX) and I was running the list to get the next person out; which was the controller at Sector Y (combined with Sector Z). As I was previewing the sector; I saw the EDST (En Route Decision Support Tool) had over half a page of aircraft and a lot of military airspace was active on the scope. During the position relief briefing; the controller stated there was an aircraft cleared out of ZZZ and we were waiting for them to depart (Aircraft X). There was also another GA arrival going into ZZZ1 (another uncontrolled airport); who had all the information and was looking for a visual. At the time; there were multiple VFR aircraft on codes for flight following; many VFR targets throughout; and a steady amount of traffic (both IFR and VFR) transitioning through the combined sectors. Aircraft X had initially checked in after departing; climbing to 3000 per the original clearance. As I was sitting down at the scope; I went to call and coordinate a point-out and cancel the block with ZZZ2; but saw a VFR traffic in front of Aircraft X; which I immediately hung up the line and called traffic. The VFR target was at their 1 o'clock and moving slightly northeast bound when I called it with Aircraft X climbing about a mile south of the target. I did not have full altitude visible since the Airline's datablock had partially obscured it. To the best of my ability; I saw 2000 + then on the next hit saw 3000 on the VFR target. Aircraft X said they had traffic in sight and the traffic was 500ft above them. Aircraft X then said they would respond to the RA and descended back down to 2000 until clear. Before the relieved controller left the area; I had them sit back down on the D-side until I could regain control of the sector. There were many aircraft coming in and out of the sector with multiple departures from all of the adjacent approach controls and military aircraft with requests.Spend more time previewing and having a better handle of a busy sector before taking it. Making sure there are no immediate potential conflicts at those sectors or addressing those conflicts with the controller being relieved before assuming the position.","Human Factors; Environment - Non Weather Related","ATC Issue All Types; Conflict NMAC; Deviation / Discrepancy - Procedural Published Material / Policy","Air Traffic Control Provided Assistance; Air Traffic Control Issued New Clearance; Flight Crew FLC complied w / Automation / Advisory; Flight Crew Took Evasive Action","Climb","","","Communication Breakdown; Distraction; Situational Awareness; Time Pressure; Workload"
"OTHER","A TRACON Controller reported an aircraft executed a missed approach but deviated from the procedure placing it below an aircraft on approach to a nearby airport. Reporter stated they hesitated to take action due to being fatigued from working at a facility with insufficient staffing.","I was working multiple combined positions. I heard ZZZ1 tower yell over the line that they were descending someone immediately. I observed Aircraft X climbing on the missed approach. I called local at ZZZ [tower] to alert them to the situation since I had already shipped Aircraft Y to tower. I observed a loss of separation but separation had already been reestablished. As I watched the situation unfold Aircraft X was at 1500 but didn't appear to be flying the published missed. I was unsure of what he would do or how the situation was going to be resolved since he was still flying south. I didn't want Aircraft Y to descend into him on the approach into ZZZ so I called ZZZ local back and told them to climb Aircraft Y to 4000 runway heading. There was some hesitation on both of our parts as it did eventually look like maybe they would remain separated. Knowing it was IFR and not wanting to take any risks I told local to just send him around. I was very tired after a long and exhausting shift with low staffing and busy volume all night. I believe this contributed to the hesitation; but in the end the right decision was made as both aircraft remained separated and landed safely. The Aircraft Y pilot was very appreciative on frequency when I explained what happened.It is common for go arounds at ZZZ1 to climb above the initial 1500' restriction on the missed approach. The 'top altitude' if there is such a thing on a missed approach; but there is a 1500' initial restriction to keep them separated from ZZZ arrivals. Something needs to change so that pilots aren't accidentally climbing to 3000 when they are busy with a go around as this is very dangerous with ZZZ arrivals at 3000' and descending to Runway XX. We have been briefed in the past the missed approach for arrivals to Runway XY at ZZZ1 in not procedurally separated from the ILS to Runway XXL/R at ZZZ; so we should not be running both approaches simultaneously until the procedure is changed to provide positive separation. This has been brought up in the past but the agency demands they both be used without taking any action to correct the problem. Additionally with the poor staffing in this area there is constantly too many planes to provide a safe operation; yet we are forced to just keep working too many planes hoping that nothing bad happens. The volume of traffic needs to be significantly reduced in the interest of safety and to prevent controller fatigue and burnout.","Company Policy; Chart Or Publication; Airspace Structure; Human Factors; Procedure","ATC Issue All Types; Conflict Airborne Conflict; Deviation - Track / Heading All Types; Deviation / Discrepancy - Procedural Published Material / Policy","Air Traffic Control Issued New Clearance; Air Traffic Control Separated Traffic","Climb","","","Communication Breakdown; Confusion; Situational Awareness; Workload; Troubleshooting; Time Pressure"
"OTHER","General aviation pilot reported flight toward terrain while maneuvering during cruise.","I was ferrying an OV-10 Bronco from ZZZ to ZZZ1 to an Air Museum that was putting on a tribute. It was early morning; and noise abatement is always a concern; and I knew that the area I was near had a resident who was extremely noise sensitive and would report airplanes flying over. Anyways; there were various clouds layers; and in order to fly as far away from the homes; while still staying VFR under the cloud layer; I tucked the airplane up as high as I safely could into the hills. As I was cruising along the hills; I cleared a ridge and made a turn; I flew near a several trucks that were doing some work in the mountains on an area of steep terrain. I did not expect them to be there as the entire area was uninhabited and I believed it was free of persons or property. I flew just south of and well above the trucks as I could not turn away in time; and I estimate my distance was at least 500'; but it was closer than I ever would want to fly to persons or property on the surface in cruise flight. I continued my cruise flight and was able to climb higher between layers and proceeded on my way further minimizing noise on this morning.This could have been prevented if I had elected to fly further towards the populated area. My emphasis on noise abatement was so strong that it affected my decision as to where I should fly in cruise flight; and in retrospect; I should have flown a mile or so closer to the area in order to give me more maneuvering room and time to spot the equipment. I'm very comfortable flying in the mountains; and this has been the first time I've encountered such trucks on the steep areas in the mountains. I will plan my route more carefully next time in relation to this possibility.","Human Factors","Deviation / Discrepancy - Procedural FAR; Deviation / Discrepancy - Procedural Published Material / Policy; Inflight Event / Encounter CFTT / CFIT; Inflight Event / Encounter Weather / Turbulence","General None Reported / Taken","Cruise","","","Situational Awareness"
"OTHER","SR20 Flight Instructor reported an NMAC event during landing training. The Flight Instructor took evasive action which avoided a collision.","We were executing the LAT midfield crossing procedure which is to over fly the airport 1000' above TPA; wait 20 seconds; and start a modified tear drop turn into the left downwind for runway XX. There was a lot of radio static; no readable transmissions. It sounded more like a stuck mic than someone trying to transmit. We made appropriate 10 nm; 5 nm; and crossing midfield calls. Shortly after crossing midfield at 3300' and beginning our descent; IP; SP; and back seater all spotted traffic out front window coming towards us. IP took controls and pulled up and turned left to avoid getting any nearer to traffic. After this occurred; we attempted again to contact traffic to which they replied 'that was me; sorry'.","Human Factors","Conflict NMAC","Flight Crew Took Evasive Action","Initial Approach","","","Workload; Communication Breakdown; Time Pressure"
"OTHER","ZLC Controller reported scheduled GPS Jamming in their sector resulted in loss of radar contact with aircraft resulting in one of them flying below the Minimum Vectoring Altitude.","I was D-Side for sectors 30/31. BOV radar was out. There was GPS jamming causing multiple aircraft to be on vectors due to lost GPS capabilities. We had Aircraft X on a heading due to reported loss of GPS. He was south east of TWF and recently climbed to 120 for terrain. We lost radar on Aircraft X; we were unable to climb him due to overhead traffic at 130. We were unable to give instructions to join the V484 due to the MEA being 160. Aircraft X was last seen on a heading to avoid a 123 MIA (Minimum IFR Altitude) box; but we lost radar monitoring capabilities. Aircraft X was ADS-B equipped; but we weren't receiving several ADS-B targets due to the jamming. As soon as radar contact was lost I went to my OS (Operation Supervisor) and asked for stop buzzer due to the situation. Instead of calling for stop buzzer the OS came over to our position; stood behind us and tried to give us instructions on what to do; all of which we were unable due to reasons listed above. The OS finally went to call for stop buzzer; by which time we reacquired radar on Aircraft X.Recommendation: OS should have accepted controller request for stop buzzerGPS jamming mission sheet with anticipated affect should be placed at the position; this used to be done and was stopped for some reason.GPS jamming should have been cancelled after BOV radar outage.","Software and Automation; Airspace Structure; Chart Or Publication; ATC Equipment / Nav Facility / Buildings","ATC Issue All Types; Deviation / Discrepancy - Procedural Published Material / Policy; Ground Event / Encounter Ground Equipment Issue; Inflight Event / Encounter CFTT / CFIT","Air Traffic Control Provided Assistance","Cruise","","","Time Pressure; Workload; Communication Breakdown"
"OTHER","C172 Instructor reported receiving conflicting ATC clearance in the traffic pattern followed by a NMAC event.","While on downwind to Runway XX; we were advised by the tower to follow the C-172 aircraft in front of us. As he turned base to final; the student started the base turn upon which the tower instructed us to perform a 360-degree turn. The student rolled out from the 360 on base and shortly after he was told to make another 360-degree turn on base.  Upon completing the 360-degree turn he was requested to turn downwind for traffic that we had not heard about; and no description of the traffic was given to us.  Upon turning downwind; a Pilatus PC-12 passed us 300 to 400 feet on our right side; and he was not talking to the tower.  After the Pilatus passed on our right; he started talking to the tower and requested clearance to land. Tower instructed us to follow the Pilatus for landing #2 Runway XX.At no time did I hear any radio traffic between the tower and the Pilatus until he passed us on our right at which time he communicated with the tower for clearance.After landing; ground control asked the student if there was an instructor at which time ground asked me what transpired on final. I advised ground that we were told to do two 360 -degree turns and extend the downwind.","Airport","ATC Issue All Types; Conflict NMAC; Deviation / Discrepancy - Procedural Clearance; Deviation / Discrepancy - Procedural Published Material / Policy","Flight Crew Requested ATC Assistance / Clarification","Final Approach","","","Communication Breakdown"
"OTHER","GA Flight Instructor with student reported a CFTT event while performing eights on pylons maneuvers.","We were doing 8's on pylon's and we got low to the ground; possibly breaking the 500 feet over non congested area regulation. We were approximately 300 feet lower than our pivotal altitude at one point. The terrain was not flat; due to gorges; so it was hard to accurately judge the ground elevation.Cause: Inaccurate planning of alt and not holding alt (maneuver is based on changing altitude).Suggestions: Choose a better area to do maneuvers with better terrain.","Human Factors","Deviation / Discrepancy - Procedural Published Material / Policy; Deviation / Discrepancy - Procedural FAR; Inflight Event / Encounter CFTT / CFIT","General None Reported / Taken","Other Maneuvering","","","Training / Qualification; Situational Awareness"
"OTHER","Air carrier Captain reported the ATIS required aircraft to do a charted visual flight procedure but ATC vectored the flight crew to a final approach that was a visual straight-in instead.","BDEGA Star. After SFO STAR shows 140 heading. This puts expected flight path on southwest side of field. Difficult planning for approach. Determining expected runway a guess. ATIS shows ONLY CVFP (Charted Visual Flight Procedure) for both 28L and 28R. TIPTOE CVFP comes in from south to 28L. FMS BRIDGE VISUAL comes in from both north (ARCHI) and south (EDDYY) to 28R. Clearance to fly 090 after CORKK... puts aircraft north of approach corridor. We planned and briefed EVERYTHING; except FO didn't talk about engine out procedure... second issue. The only ATC instructions we got were fly 090 after CORKK. We pass abeam the field at 10k feet then turned 190 for base. Jammed slightly on base turn. It seemed we were getting vectors to a visual straight in; 284-degree extended final lined up on runway extended centerline; NOT the new TCAS compliant offset final in the FMS BRIDGE VISUAL.On a tight base with flaps out in steep descent at about 6000 I was concerned that we weren't getting the offset CVFP advertised on ATIS and queried ATC. They said we were being vectored to the visual. The procedures required to fly the offset FMS visual; basically an RNAV approach; and a visual straight in on runway centerline backed up with an ILS or any straight in approach are substantial. We were asked if we saw the Runway 28L traffic we were paired up with. In the task saturated reprogramming of the approach I was heads down. The flying pilot was also very busy managing energy and trying to make the approach; which wasn't set up yet; work. From a systems perspective I cannot conceive of a more hazardous way to sequence airplanes into an airport then have them descending into terrain at night turning belly up to traffic on a close parallel runway; with the crews guessing as to what runway and the multiple ways to approach either runway; requiring extensive reprogramming of avionics to make the differing approaches work properly. This was a clear day; with an experienced crew; with nothing going on. We were task saturated despite extensive preparation and many options briefed. We never did see the traffic we were paired with. We were cleared the visual because they saw us.The root cause of the problem is the airport not doing what is advertised on ATIS. We did not do a CVFP. The final approach course for a visual straight in and CVFP are different. Second issue… not briefing engine out plan. Our SOP doesn't require it. On the latest sim training I did we had to fly the engine out procedures at SFO. Company seems to expect that this is flown off raw data. It took my sim partner 3 attempts to do this properly; knowing it was coming; studying it; briefing it. There seems to be an understanding that it isn't required to brief this for an approach. I think the chances of hitting a bird on short final; losing an engine; and going around without briefing this situation has little chance of success. Trying to find the procedure; read the correct part of the chart; finding the VOR frequency on an approach plate; retuning your NAVAIDs; changing the course; reconfiguring the aircraft; and changing MCP (Mode Control Panel) modes while potentially accomplishing immediate action items; possibly at night/IMC; as the end of the runway goes by at a few hundred feet flying into mountainous terrain has very low probability of success. I am surprised we are going to be required to brief how we are going to flare on every landing; but this very complicated procedure we don't have to plan for.","Chart Or Publication; Procedure","ATC Issue All Types; Deviation / Discrepancy - Procedural Published Material / Policy","Flight Crew Requested ATC Assistance / Clarification","Descent","","","Workload; Training / Qualification; Situational Awareness; Confusion; Communication Breakdown"
"OTHER","C172 Flight Instructor on training flight with student reported a near miss with a helicopter.","I came within approximately 500 feet of a helicopter while conducting a XC training flight with a student. I was flying at 7500' MSL and the helicopter was shown on ADS-B as being 500 feet below us. I spotted the aircraft approaching on ADS-B but did not spot it visually until it was with approximately 0.5 miles of my position. I was monitoring the practice area frequency at that time but had not made a call at that point. Looking back I likely should have executed a 180 degree turn away from the helicopter instead of choosing to overfly the helicopter/over fly just in front of the helicopter's path. My student and I then completed the flight without incident.","Human Factors; Procedure","ATC Issue All Types; Conflict NMAC","Flight Crew Took Evasive Action","Cruise","","","Situational Awareness"
